{"schema":"urn:fyi-cli:internet-archive-replay-selection:1","selection_sha256":"a2114e4c8a53be859ce987db2a1947c0642e293093cb7dedece5bf4c6cb0f933","source_cdx_sha256":"954b0f80ad2a44038f364d240cc9baac815f252a43535c8403dec060ddb730bd","rows":[{"cdx_digest":"sha256:synthetic-cdx-digest","cdx_length":321,"cdx_statuscode":200,"expected_media_type":"application/json","expected_payload_bytes":50,"expected_payload_sha256":"b1de64cdb44bbcceb330c6880f7bc3d489a3a0ab3b8a761eace27d0aedab63fc","expected_status":200,"original":"https://example.test/request/1.json","row_index":0,"timestamp":"20250101000000"}]}
